{
  "version": 2,
  "example": "platformer-2d",
  "scenario": "title",
  "scene": "res://scenes/levels/main_menu.tscn",
  "pacing": "fixed",
  "extensions": {},
  "frames": 30,
  "seed": 7,
  "viewport": [1152, 648],
  "clocks": {"physics_hz": 60, "bevy_step_ns": 16666667},
  "settle": {
    "stable_frames": 3,
    "nodes": ["TitleLabel", "Label", "Options/StartButton"],
    "classes": ["Player2D", "Gem2D", "Door2D"]
  },
  "checkpoints": [
    {
      "frame": 0,
      "nodes": [
        {"path": "TitleLabel", "position": [7, 45], "tolerance": 1, "visible": true}
      ],
      "regions": [
        {"name": "credits-text", "rect": [520, 530, 124, 6], "non_blank": {"background": [77, 77, 77], "tolerance": 4, "min_fraction": 0.2}, "dominant_colour": {"rgb": [77, 77, 77], "tolerance": 255}}
      ]
    },
    {
      "frame": 30,
      "nodes": [
        {"path": "TitleLabel", "position": [7, 45], "tolerance": 1, "visible": true}
      ],
      "regions": [
        {"name": "credits-text", "rect": [520, 530, 124, 6], "non_blank": {"background": [77, 77, 77], "tolerance": 4, "min_fraction": 0.2}, "dominant_colour": {"rgb": [77, 77, 77], "tolerance": 255}}
      ]
    }
  ]
}
